{
  "$schema": "https://json-schema.org/draft/2020-12/schema",
  "type": "array",
  "items": {
    "type": "object",
    "required": ["id", "type", "tags", "question", "answer"],
    "properties": {
      "id": {"type": "string", "pattern": "^[a-z0-9-]+$"},
      "type": {"type": "string"},
      "tags": {
        "type": "array",
        "items": {"type": "string"},
        "uniqueItems": true
      },
      "question": {"type": "string"},
      "front_code": {"type": "string"},
      "answer": {
        "type": "object",
        "properties": {
          "reflex": {"type": "string"},
          "code": {"type": "string"},
          "template": {"type": "string"},
          "bullets": {"type": "array", "items": {"type": "string"}},
          "note": {"type": "string"},
          "example": {
            "type": "object",
            "properties": {
              "prompt": {"type": "string"},
              "code": {"type": "string"}
            },
            "additionalProperties": false
          }
        },
        "additionalProperties": false
      }
    },
    "additionalProperties": false
  }
}
